{
  "name": "onfido_handle_webhook",
  "title": "Onfido Handle Webhook",
  "description": "Provides an API endpoint for Onfido's webhook functionality to send events to. Allows for processing of events including report and check details.",
  "connectors": [
    "okta",
    "http"
  ],
  "links": [
    {
      "title": "Setup Documentation",
      "destination": "https://github.com/jhickmanit/onfido-handle-webhook/blob/master/readme.md"
    }
  ]
}