{
  "name": "googledrive_reassign_files",
  "title": "Reassign Files while Deprovisioning with Google Drive",
  "description": "In many organizations that use Google Drive, there is a requirement to transfer a user's GDrive contents to another user. Maybe you have users that need to be deactivated - you can transfer the files from the user's GDrive to the Manager and delete the user.",
  "connectors": [
    "googledrive"
  ],
  "links": [
    {
      "title": "Video",
      "destination": "https://www.youtube.com/watch?v=iMuCUhoB0v4"
    },
    {
      "title": "Documentation",
      "destination": "https://github.com/okta/workflows-templates/blob/master/workflows/googledrive_reassign_files/readme.md"
    }
  ]
}
